{
  "schema_version": 1,
  "processor_config": "picorv32_rv32i",
  "producer": "dut",
  "program_profile": "smoke",
  "isa": "rv32i",
  "complete": true,
  "program_sha256": "91e830ffd08bb432d17515c87e2c1d8617c900eb53f2df1b32b2859afc7fef27",
  "records": [
    {
      "order": 0,
      "native_order": 0,
      "hart": 0,
      "pc": 128,
      "insn": 19923091,
      "rd_address": 1,
      "rd_data": 19,
      "trap": false,
      "halt": false,
      "interrupt": false,
      "memory": null
    },
    {
      "order": 1,
      "native_order": 1,
      "hart": 0,
      "pc": 132,
      "insn": 4291821843,
      "rd_address": 2,
      "rd_data": 4294967293,
      "trap": false,
      "halt": false,
      "interrupt": false,
      "memory": null
    },
    {
      "order": 2,
      "native_order": 2,
      "hart": 0,
      "pc": 136,
      "insn": 2130355,
      "rd_address": 3,
      "rd_data": 16,
      "trap": false,
      "halt": false,
      "interrupt": false,
      "memory": null
    },
    {
      "order": 3,
      "native_order": 3,
      "hart": 0,
      "pc": 140,
      "insn": 1075872307,
      "rd_address": 4,
      "rd_data": 22,
      "trap": false,
      "halt": false,
      "interrupt": false,
      "memory": null
    },
    {
      "order": 4,
      "native_order": 4,
      "hart": 0,
      "pc": 144,
      "insn": 4309683,
      "rd_address": 5,
      "rd_data": 6,
      "trap": false,
      "halt": false,
      "interrupt": false,
      "memory": null
    },
    {
      "order": 5,
      "native_order": 5,
      "hart": 0,
      "pc": 148,
      "insn": 4919,
      "rd_address": 6,
      "rd_data": 4096,
      "trap": false,
      "halt": false,
      "interrupt": false,
      "memory": null
    },
    {
      "order": 6,
      "native_order": 6,
      "hart": 0,
      "pc": 152,
      "insn": 5447715,
      "rd_address": 0,
      "rd_data": 0,
      "trap": false,
      "halt": false,
      "interrupt": false,
      "memory": {
        "kind": "store",
        "address": 4096,
        "mask": 15,
        "data": 6
      }
    },
    {
      "order": 7,
      "native_order": 7,
      "hart": 0,
      "pc": 156,
      "insn": 205699,
      "rd_address": 7,
      "rd_data": 6,
      "trap": false,
      "halt": false,
      "interrupt": false,
      "memory": {
        "kind": "load",
        "address": 4096,
        "mask": 15,
        "data": 6
      }
    },
    {
      "order": 8,
      "native_order": 8,
      "hart": 0,
      "pc": 160,
      "insn": 5473379,
      "rd_address": 0,
      "rd_data": 0,
      "trap": false,
      "halt": false,
      "interrupt": false,
      "memory": null
    },
    {
      "order": 9,
      "native_order": 9,
      "hart": 0,
      "pc": 168,
      "insn": 5477475,
      "rd_address": 0,
      "rd_data": 0,
      "trap": false,
      "halt": false,
      "interrupt": false,
      "memory": null
    },
    {
      "order": 10,
      "native_order": 10,
      "hart": 0,
      "pc": 172,
      "insn": 1043,
      "rd_address": 8,
      "rd_data": 0,
      "trap": false,
      "halt": false,
      "interrupt": false,
      "memory": null
    },
    {
      "order": 11,
      "native_order": 11,
      "hart": 0,
      "pc": 176,
      "insn": 8389871,
      "rd_address": 9,
      "rd_data": 180,
      "trap": false,
      "halt": false,
      "interrupt": false,
      "memory": null
    },
    {
      "order": 12,
      "native_order": 12,
      "hart": 0,
      "pc": 184,
      "insn": 1049875,
      "rd_address": 10,
      "rd_data": 1,
      "trap": false,
      "halt": false,
      "interrupt": false,
      "memory": null
    },
    {
      "order": 13,
      "native_order": 13,
      "hart": 0,
      "pc": 188,
      "insn": 10691107,
      "rd_address": 0,
      "rd_data": 0,
      "trap": false,
      "halt": false,
      "interrupt": false,
      "memory": {
        "kind": "store",
        "address": 4100,
        "mask": 15,
        "data": 1
      }
    }
  ]
}
